PaperID,Title
100001,No-Regret Exploration in Goal-Oriented Reinforcement Learning
100002,Stochastic bandits with arm-dependent delays
100003,Improved Sleeping Bandits with Stochastic Action Sets and Adversarial Rewards
100004,On Implicit Regularization in beta-VAEs
100005,Weakly-Supervised Disentanglement Without Compromises
100006,Learning Robot Skills with Temporal Variational Inference
100007,A Simple Framework for Contrastive Learning of Visual Representations
100008,A Geometric Approach to Archetypal Analysis via Sparse Projections
100009,Understanding the Curse of Horizon in Off-Policy Evaluation via Conditional Importance Sampling
100010,Reinforcement Learning in Feature Space: Matrix Bandit Kernels and Regret Bound